{
  "model": "ACCESS-ESM1.6",
  "experiment_id": "amip",
  "variant_label": "r2i1p1f1",
  "updated_by": "sync_publications.py",
  "variables": {
    "atmos.areacella.ti-u-hxy-u.fx.glb": {
      "status": "published",
      "notes": "v20261014 in /g/data/im55/publications"
    },
    "atmos.cl.tavg-al-hxy-u.mon.glb": {
      "status": "published",
      "notes": "v20261014 in /g/data/im55/publications"
    },
    "atmos.cli.tavg-al-hxy-u.mon.glb": {
      "status": "published",
      "notes": "v20261014 in /g/data/im55/publications"
    },
    "atmos.clivi.tavg-u-hxy-u.mon.glb": {
      "status": "published",
      "notes": "v20261014 in /g/data/im55/publications"
    },
    "atmos.clt.tavg-u-hxy-u.mon.glb": {
      "status": "published",
      "notes": "v20261014 in /g/data/im55/publications"
    },
    "atmos.clw.tavg-al-hxy-u.mon.glb": {
      "status": "published",
      "notes": "v20261014 in /g/data/im55/publications"
    },
    "atmos.clwvi.tavg-u-hxy-u.mon.glb": {
      "status": "published",
      "notes": "v20261014 in /g/data/im55/publications"
    },
    "atmos.evspsbl.tavg-u-hxy-u.mon.glb": {
      "status": "published",
      "notes": "v20261014 in /g/data/im55/publications"
    },
    "atmos.hfls.tavg-u-hxy-u.mon.glb": {
      "status": "published",
      "notes": "v20261014 in /g/data/im55/publications"
    },
    "atmos.hfss.tavg-u-hxy-u.mon.glb": {
      "status": "published",
      "notes": "v20261014 in /g/data/im55/publications"
    },
    "atmos.hur.tavg-p19-hxy-air.mon.glb": {
      "status": "published",
      "notes": "v20261014 in /g/data/im55/publications"
    },
    "atmos.hurs.tavg-h2m-hxy-u.mon.glb": {
      "status": "published",
      "notes": "v20261014 in /g/data/im55/publications"
    },
    "atmos.hus.tavg-p19-hxy-u.mon.glb": {
      "status": "published",
      "notes": "v20261014 in /g/data/im55/publications"
    },
    "atmos.huss.tavg-h2m-hxy-u.mon.glb": {
      "status": "published",
      "notes": "v20261014 in /g/data/im55/publications"
    },
    "atmos.pr.tavg-u-hxy-u.mon.glb": {
      "status": "published",
      "notes": "v20261014 in /g/data/im55/publications"
    },
    "atmos.prc.tavg-u-hxy-u.mon.glb": {
      "status": "published",
      "notes": "v20261014 in /g/data/im55/publications"
    },
    "atmos.prsn.tavg-u-hxy-u.mon.glb": {
      "status": "published",
      "notes": "v20261014 in /g/data/im55/publications"
    },
    "atmos.prw.tavg-u-hxy-u.mon.glb": {
      "status": "published",
      "notes": "v20261014 in /g/data/im55/publications"
    },
    "atmos.ps.tavg-u-hxy-u.mon.glb": {
      "status": "published",
      "notes": "v20261014 in /g/data/im55/publications"
    },
    "atmos.psl.tavg-u-hxy-u.mon.glb": {
      "status": "published",
      "notes": "v20261014 in /g/data/im55/publications"
    },
    "atmos.rlds.tavg-u-hxy-u.mon.glb": {
      "status": "published",
      "notes": "v20261014 in /g/data/im55/publications"
    },
    "atmos.rldscs.tavg-u-hxy-u.mon.glb": {
      "status": "published",
      "notes": "v20261014 in /g/data/im55/publications"
    },
    "atmos.rlus.tavg-u-hxy-u.mon.glb": {
      "status": "published",
      "notes": "v20261014 in /g/data/im55/publications"
    },
    "atmos.rluscs.tavg-u-hxy-u.mon.glb": {
      "status": "published",
      "notes": "v20261014 in /g/data/im55/publications"
    },
    "atmos.rlut.tavg-u-hxy-u.mon.glb": {
      "status": "published",
      "notes": "v20261014 in /g/data/im55/publications"
    },
    "atmos.rlutcs.tavg-u-hxy-u.mon.glb": {
      "status": "published",
      "notes": "v20261014 in /g/data/im55/publications"
    },
    "atmos.rsds.tavg-u-hxy-u.mon.glb": {
      "status": "published",
      "notes": "v20261014 in /g/data/im55/publications"
    },
    "atmos.rsdscs.tavg-u-hxy-u.mon.glb": {
      "status": "published",
      "notes": "v20261014 in /g/data/im55/publications"
    },
    "atmos.rsdt.tavg-u-hxy-u.mon.glb": {
      "status": "published",
      "notes": "v20261014 in /g/data/im55/publications"
    },
    "atmos.rsus.tavg-u-hxy-u.mon.glb": {
      "status": "published",
      "notes": "v20261014 in /g/data/im55/publications"
    },
    "atmos.rsuscs.tavg-u-hxy-u.mon.glb": {
      "status": "published",
      "notes": "v20261014 in /g/data/im55/publications"
    },
    "atmos.rsut.tavg-u-hxy-u.mon.glb": {
      "status": "published",
      "notes": "v20261014 in /g/data/im55/publications"
    },
    "atmos.rsutcs.tavg-u-hxy-u.mon.glb": {
      "status": "published",
      "notes": "v20261014 in /g/data/im55/publications"
    },
    "atmos.sfcWind.tavg-h10m-hxy-u.mon.glb": {
      "status": "published",
      "notes": "v20261014 in /g/data/im55/publications"
    },
    "atmos.sftlf.ti-u-hxy-u.fx.glb": {
      "status": "published",
      "notes": "v20261014 in /g/data/im55/publications"
    },
    "atmos.ta.tavg-p19-hxy-air.mon.glb": {
      "status": "published",
      "notes": "v20261014 in /g/data/im55/publications"
    },
    "atmos.tas.tavg-h2m-hxy-u.mon.glb": {
      "status": "published",
      "notes": "v20261014 in /g/data/im55/publications"
    },
    "atmos.tas.tmaxavg-h2m-hxy-u.mon.glb": {
      "status": "published",
      "notes": "v20261014 in /g/data/im55/publications"
    },
    "atmos.tas.tminavg-h2m-hxy-u.mon.glb": {
      "status": "published",
      "notes": "v20261014 in /g/data/im55/publications"
    },
    "atmos.tauu.tavg-u-hxy-u.mon.glb": {
      "status": "published",
      "notes": "v20261014 in /g/data/im55/publications"
    },
    "atmos.tauv.tavg-u-hxy-u.mon.glb": {
      "status": "published",
      "notes": "v20261014 in /g/data/im55/publications"
    },
    "atmos.ts.tavg-u-hxy-u.mon.glb": {
      "status": "published",
      "notes": "v20261014 in /g/data/im55/publications"
    },
    "atmos.ua.tavg-p19-hxy-air.mon.glb": {
      "status": "published",
      "notes": "v20261014 in /g/data/im55/publications"
    },
    "atmos.uas.tavg-h10m-hxy-u.mon.glb": {
      "status": "published",
      "notes": "v20261014 in /g/data/im55/publications"
    },
    "atmos.va.tavg-p19-hxy-air.mon.glb": {
      "status": "published",
      "notes": "v20261014 in /g/data/im55/publications"
    },
    "atmos.vas.tavg-h10m-hxy-u.mon.glb": {
      "status": "published",
      "notes": "v20261014 in /g/data/im55/publications"
    },
    "atmos.wap.tavg-p19-hxy-air.mon.glb": {
      "status": "published",
      "notes": "v20261014 in /g/data/im55/publications"
    },
    "atmos.zg.tavg-p19-hxy-air.mon.glb": {
      "status": "published",
      "notes": "v20261014 in /g/data/im55/publications"
    },
    "land.cSoil.tavg-u-hxy-lnd.mon.glb": {
      "status": "published",
      "notes": "v20261014 in /g/data/im55/publications"
    },
    "land.cVeg.tavg-u-hxy-lnd.mon.glb": {
      "status": "published",
      "notes": "v20261014 in /g/data/im55/publications"
    },
    "land.evspsblsoi.tavg-u-hxy-lnd.mon.glb": {
      "status": "published",
      "notes": "v20261014 in /g/data/im55/publications"
    },
    "land.evspsblveg.tavg-u-hxy-lnd.mon.glb": {
      "status": "published",
      "notes": "v20261014 in /g/data/im55/publications"
    },
    "land.fBNF.tavg-u-hxy-lnd.mon.glb": {
      "status": "published",
      "notes": "v20261014 in /g/data/im55/publications"
    },
    "land.gpp.tavg-u-hxy-lnd.mon.glb": {
      "status": "published",
      "notes": "v20261014 in /g/data/im55/publications"
    },
    "land.lai.tavg-u-hxy-lnd.mon.glb": {
      "status": "published",
      "notes": "v20261014 in /g/data/im55/publications"
    },
    "land.mrro.tavg-u-hxy-lnd.mon.glb": {
      "status": "published",
      "notes": "v20261014 in /g/data/im55/publications"
    },
    "land.mrros.tavg-u-hxy-lnd.mon.glb": {
      "status": "published",
      "notes": "v20261014 in /g/data/im55/publications"
    },
    "land.mrso.tavg-u-hxy-lnd.mon.glb": {
      "status": "published",
      "notes": "v20261014 in /g/data/im55/publications"
    },
    "land.mrsofc.ti-u-hxy-lnd.fx.glb": {
      "status": "published",
      "notes": "v20261014 in /g/data/im55/publications"
    },
    "land.mrsol.tavg-d10cm-hxy-lnd.mon.glb": {
      "status": "published",
      "notes": "v20261014 in /g/data/im55/publications"
    },
    "land.nbp.tavg-u-hxy-lnd.mon.glb": {
      "status": "published",
      "notes": "v20261014 in /g/data/im55/publications"
    },
    "land.orog.ti-u-hxy-u.fx.glb": {
      "status": "published",
      "notes": "v20261014 in /g/data/im55/publications"
    },
    "land.ra.tavg-u-hxy-lnd.mon.glb": {
      "status": "published",
      "notes": "v20261014 in /g/data/im55/publications"
    },
    "land.rh.tavg-u-hxy-lnd.mon.glb": {
      "status": "published",
      "notes": "v20261014 in /g/data/im55/publications"
    },
    "land.rootd.ti-u-hxy-lnd.fx.glb": {
      "status": "published",
      "notes": "v20261014 in /g/data/im55/publications"
    },
    "land.sftgif.ti-u-hxy-u.fx.glb": {
      "status": "published",
      "notes": "v20261014 in /g/data/im55/publications"
    },
    "land.slthick.ti-sl-hxy-lnd.fx.glb": {
      "status": "published",
      "notes": "v20261014 in /g/data/im55/publications"
    },
    "land.tsl.tavg-sl-hxy-lnd.mon.glb": {
      "status": "published",
      "notes": "v20261014 in /g/data/im55/publications"
    },
    "landIce.mrfso.tavg-u-hxy-lnd.mon.glb": {
      "status": "published",
      "notes": "v20261014 in /g/data/im55/publications"
    },
    "landIce.snc.tavg-u-hxy-lnd.mon.glb": {
      "status": "published",
      "notes": "v20261014 in /g/data/im55/publications"
    },
    "landIce.snw.tavg-u-hxy-lnd.mon.glb": {
      "status": "published",
      "notes": "v20261014 in /g/data/im55/publications"
    }
  },
  "updated_at": "2026-10-19T20:02:18+00:00"
}
